config_name,config_display,description,features_removed,features_used,accuracy,precision,recall,f1_score,roc_auc,avg_precision,confusion_matrix
baseline,Baseline (All Features),Full model with all features including ATA risk and variants,[],33,0.7666666666666667,0.8333333333333334,0.6666666666666666,0.7407407407407407,0.8800000000000001,0.8730679359626727,"[[13, 2], [5, 10]]"
no_risk_level,Without ATA Risk Level,Removes ret_risk_level and its interaction terms,"['ret_risk_level', 'risk_calcitonin_interaction', 'risk_age_interaction']",30,0.8,0.8461538461538461,0.7333333333333333,0.7857142857142857,0.9111111111111111,0.9009076109076108,"[[13, 2], [4, 11]]"
no_variants,Without Variant Encodings,Removes all one-hot encoded RET variant features,['variant_'],19,0.8,0.8,0.8,0.8,0.8800000000000001,0.8742899546846914,"[[12, 3], [3, 12]]"
no_genetics,Without Any Genetic Features,Removes all genetic-derived features (risk level + variants) - tests pure biomarker prediction,"['ret_risk_level', 'risk_calcitonin_interaction', 'risk_age_interaction', 'variant_']",16,0.8,0.8,0.8,0.8,0.8711111111111112,0.8623851927799295,"[[12, 3], [3, 12]]"
no_calcitonin,Without Calcitonin,Removes calcitonin features - tests genetic-only prediction,"['calcitonin_elevated', 'calcitonin_level_numeric', 'calcitonin_age_interaction']",30,0.7,0.8,0.5333333333333333,0.64,0.8177777777777777,0.7887391149155856,"[[13, 2], [7, 8]]"
no_cea,Without CEA,Removes CEA to address reviewer concern about weak imputation,['cea_level_numeric'],32,0.7666666666666667,0.8333333333333334,0.6666666666666666,0.7407407407407407,0.8577777777777779,0.847129918012271,"[[13, 2], [5, 10]]"
genetics_only,Genetics Only (No Biomarkers),"Only genetic features + demographics - tests if prediction is ""just consensus""","['calcitonin_elevated', 'calcitonin_level_numeric', 'calcitonin_age_interaction', 'cea_level_numeric', 'thyroid_nodules_present', 'multiple_nodules', 'nodule_severity']",27,0.7333333333333333,0.8888888888888888,0.5333333333333333,0.6666666666666666,0.8533333333333335,0.8282250011197381,"[[14, 1], [7, 8]]"
biomarkers_only,Biomarkers Only (No Genetics),Only biomarker features - tests clinical utility without genetic encoding,"['ret_risk_level', 'risk_calcitonin_interaction', 'risk_age_interaction', 'variant_']",16,0.8,0.8,0.8,0.8,0.8711111111111112,0.8623851927799295,"[[12, 3], [3, 12]]"
