config_name,config_display,description,features_removed,features_used,accuracy,precision,recall,f1_score,roc_auc,avg_precision,confusion_matrix
baseline,Baseline (All Features),Full model with all features including ATA risk and variants,[],44,0.7419354838709677,0.6521739130434783,1.0,0.7894736842105263,0.8125,0.8163007191180565,"[[8, 8], [0, 15]]"
no_risk_level,Without ATA Risk Level,Removes ret_risk_level and its interaction terms,"['ret_risk_level', 'risk_calcitonin_interaction', 'risk_age_interaction']",41,0.7096774193548387,0.625,1.0,0.7692307692307693,0.7833333333333333,0.7587749115922491,"[[7, 9], [0, 15]]"
no_variants,Without Variant Encodings,Removes all one-hot encoded RET variant features,['variant_'],20,0.7419354838709677,0.6521739130434783,1.0,0.7894736842105263,0.8416666666666667,0.8390213054918937,"[[8, 8], [0, 15]]"
no_genetics,Without Any Genetic Features,Removes all genetic-derived features (risk level + variants) - tests pure biomarker prediction,"['ret_risk_level', 'risk_calcitonin_interaction', 'risk_age_interaction', 'variant_']",17,0.6774193548387096,0.6190476190476191,0.8666666666666667,0.7222222222222222,0.7916666666666667,0.8001167471819646,"[[8, 8], [2, 13]]"
no_calcitonin,Without Calcitonin,Removes calcitonin features - tests genetic-only prediction,"['calcitonin_elevated', 'calcitonin_level_numeric', 'calcitonin_age_interaction']",41,0.7741935483870968,0.6818181818181818,1.0,0.8108108108108109,0.85,0.8443381962035212,"[[9, 7], [0, 15]]"
no_cea,Without CEA,Removes CEA to address reviewer concern about weak imputation,['cea_level_numeric'],43,0.7419354838709677,0.6521739130434783,1.0,0.7894736842105263,0.8666666666666667,0.8607687519452225,"[[8, 8], [0, 15]]"
genetics_only,Genetics Only (No Biomarkers),"Only genetic features + demographics - tests if prediction is ""just consensus""","['calcitonin_elevated', 'calcitonin_level_numeric', 'calcitonin_age_interaction', 'cea_level_numeric', 'thyroid_nodules_present', 'multiple_nodules', 'nodule_severity']",37,0.8064516129032258,0.7142857142857143,1.0,0.8333333333333334,0.8958333333333334,0.8883936433936434,"[[10, 6], [0, 15]]"
biomarkers_only,Biomarkers Only (No Genetics),Only biomarker features - tests clinical utility without genetic encoding,"['ret_risk_level', 'risk_calcitonin_interaction', 'risk_age_interaction', 'variant_']",17,0.6774193548387096,0.6190476190476191,0.8666666666666667,0.7222222222222222,0.7916666666666667,0.8001167471819646,"[[8, 8], [2, 13]]"
